translated_text_ms,Product Rating
Penghantaran Laju Bahan Kain pun Sejuk Jahitan Kemas Puas Hati,5
Alhamdulillah Kain Bagus Saiz Ngam2 Penghantaran pun Cepat Suka Sgt,5
perkhidmatan bassssss cepat betul sampai bahan setakat ok la kena dgn harga baloi2 kale saiz suma ok thorbaik,5
dah terima order xl tp biasa dpt xl slimfit warna pun tarik berapa krim lebih kpd cahaya kuning,4
Terpaksa Bagi 4 je sbb ade sikit kotor kt bhgian cerut pinggang seluae tp keseluruhan okay je ngn ngn saiz kalau ikut saiz carta yg dibi,4
Pada Baju Ada Warna Merah Cuba Basuh Masih Tongk hilah Kesan Merah Tu,3
Warna sedikit berbeza dari gambar dan saiz punya moden dan memotong macam yg biasa,2
WARNA NUDE KITA MINTA WARNA LAIN YANG SAMPAI LUPA TU TAKDE BUTANG KTA ADA PERCUMA BUTANG SANGAT KECEWA,1
Tolak Mengikuti Saiz Yg Saya Nak,5
Ukuran Tarik Sama Saiz Besar,1
