translated_text_ms,Product Rating
Baju kurta Sampai Dalam Keadaan Baik Tapi Tarik Ada,3
SIZING TINDA Tepat Langsung Aku Rasa Macam Baju Sekolah Zaman Rendah ExpressionFlessface,2
Baju kurta aku dah koyak Sebelum pakai memang tolak kualiti langsung facewithrollingeyes,2
Penghantaran Laju Kain Cantik Terima kasih Penjual MASIH TUNGGU LAGI 2Pasan Baju Untuk Smpai Pos Out Lambat Pulak Dari Yang Ini,5
Baju Selamat Mendarat Kain Cantik Dan Sedap Di Pakai Penjual Peramah ABG J T PUN Laju Buat Keja,5
Baju cantik pos dalam 4hri kualiti okay la terima kasih penjual zanyface zanyface zanyface zanyface,5
selamat sampai terima kasih ya saiz ukuran sama seperti dalam carta ukuran,5
Bungkusan Bagus Dan Baik Barang Sampai Dengan Selamat Tiada Kerosakan Dan Kebocoran Plastik Yang Di Balut Video Tiada Kait Kain Baik Dan Lembut,5
Baju Saiz 3 4 OK Semua Cantik Jahitan KEMIS Baju Saiz 1 2 Jahitan Kemas Tapi Ada Sikit Kekotoran Karat Dibelakah Baju Skrg,5
Perfect Penghantaran Sangat Cepat Kualiti Kain Pun Best Aak 1 Tahun 11 Bulan AMIK Saiz 1 2 Fit² Penjual Responden Pun Cepat,5
Bahan Baik Barang Sampai Dalam Keadaan Baik Penjual Pun Baik Ada Rezeki Akan Repeat Order Lagi Terima KASIH Penjual Terbaikkk Terbaikkkkkkkkkkkkkkkk,5
Baju Cantik Kain Ok Sedap Pakai Penhantaran Cepat Layanan Penjual Memang Terbaik la Mudah Berurusan Kalau Ade 10 Star Nak Bagi,5
TQ BARANG SUDAH SAMPAI AAK2 SUKA KAIN PUT BEST BOLEH REPEAT intone thumbsuplightskintone thumbsuplightskintone thumbsuplightskintone thumbsuplightskintone thumbsuplightskintone thumbsuplightskintone bsuplightskintone thumbsuplightskintone thumbsuplightskintone thumbsuplightskintone thumbsuplightskintone thumbsuplightskintone thumbsuplightskintone thumbsuplightskintone Thumbsuplightskintone thumblightskintone thumblightskintone thumblightskintone thumblightskintone thumblightskintone thumblightskirtightrightskintone thumblightskhingtone thumblightskintonskintone thumblightskhirticheMbshingkhightskhirtkhirtonskhirtonskuMBAthumbsuplightskintone  thumbsupmedium lightskintone  thumbsuplightskintone  thumbsuplightskintone  thumbsuplightskintone  thumbsuplightskintone  thumbsuplightskintone  star  star  star  star  star  star  star  star  star  star  star  star  star  star  star  star  star  star  star,5
warna cantik wey susah gilos nak cari color ni banya yang sudah dijual penjual pos awal tq ya ni baJu raya aktuk untuk 2021 ini walaupun tongk rentas ereri raya tetap raya okbye okbye okbye okbye,5
Alhamdulillah Semua Oke Kain Pun Cantik Warna Nya Cantik Delivery Pun Dikira Laju Tongk Berhari Tunggu Order Jumaat Isnin Hntr OK Lah Sabtu Ahad Pos Laju Cuti Facewithhandovermouth,5
Pada mulanya penjual hubungi untuk mengatakan krim warna takde jadi Kena Tukar pada akhir Yang Dihantar Warna Krim Bogel Jugak Bagaimanapun Penjual TQ Mesra dan Bergantui Cuma Poslaju Lambat Nak,5
Kain Cantik Sangat Fit Fit Size Anak Terima kasih Penjual Harga Murah Dengan Kualiti Yang,5
Baju Senget Ukuran Tongk sama Poslaju Lambat Hantar Barang Dekat 10hari Baru Sampai Baju Plk Ade Kesan Kotor So Bad Rugi Duit Aku Ini,1
item yang diterima dalam keadaan yang baik kualiti ok boleh diterima memandangkan saiz julat harga 8 sesuai dengan anak saudara saya yang berusia 8 tahun dengan sempurna tetapi saya rasa mengambil saiz 1 lebih besar kerana dia mendapat sambutan penghantaran yang agak tinggi dari penjual ke kurier agak lambat,5
Penghantaran pantas baji Sesuai muat ikut saiz cuma tangan panjang sangat nk kena baiki sikit keseluruhan semua memuaskan jahitan baik khas butang ketip ank sumus cabut lepas lepas lepas lepas lepas lepas lepas lepas lepas lepas lepas cabut lepas lepas lepas lepas lepas lepas lepas lepas cabut lepas lepas lepas lepas lepas lepas lepas lepas lepas lepas lepas lepas cabut lepas lepas lepas cabut lepas lepas cabut lepas lepas cabut lepas lepas cabut lepas cabut cabut lepas lepas cabut lepas cabut lepas cabut lepas cabut ke mana,5
Baju Dan Kain Cantik Puas Hati Dah Boleh Raya Facewithtearsofjoy,5
Baju Muat2 Je Dengan Adik Saya Umur 6 Tahun Tahun Depan Takdapat Pakai Lagi Facewithtearsofjoy Facewithtearsofjoy,5
Kain Yang Berkualiti Kain Sejuk Sedap Dipakai Cuma Saiz 5 Agak Untuk Ank 5 Tahun Dana Saiz 9 Juga Bedar Unk Ank 9 Tahun Kalau Budak Yang Badan Memang Memang Sesuai,5
perintah yang diterima dengan terima kasih smilingfaceWithhearts Kain selesa dipakai memang disyorkan thumbsup thumbsup thumbsup thumbsup thumbsup Baju memang fit2 unak anak saya setahun sebulan thumbsup,5
Terbaik Baju Cantik Saiz Fit 2 Dengan Anak Umur 1 TAHUN 10 BULAN SAIS 1 2Y,5
kualiti jahitan dan kain ok saiz 5 tahun muat unuk anak umur 3thun 4bln tinggi 106 berat 20kg cuma kena lipat sikit je bahagian tangan tangan,5
Berbaloi Tunggu Seminggu Kain Como Crepe Jahitan Pun Kemas TQ Penjual,5
Kain cantik harga pun berpatutan belikan untuk adik bongsu minta maaf video takde kena mngena selamat berpuasaa semuaaaa,5
saiz produk sempurna hanya tidak berkualiti dan harganya hanya hebat,5
Baju Selamat Sampai Seluar Fit Dengan Anak Cuma Baju Besar Sikit Tetapi Anak Tarik KeSeh Boleh Lipit Sikit Lengan Baju Fit La Anak Cakap Cantik,5
Barang Sampai Dalam Keadaan Baik Dengan Bungkusan Yang Elok Terima kasih Penjual,5
Kain Dan Color Semua Cantik Jenis Kain Tolak Mudah Kedut Tapi Selesa Untuk Budak2 N Cuaca Dekat Msia Saya Saiz Beli 3 4tahun Kalau Ada Sesipa Nak Saiz Tu Boleh Dm.,5
Kain Cun Saiz ikut saiz badan Biasa KALAU NAK LONGGAR SIKIT AMBIL SIZE BESAR SIKIT COLOR Bukan betul2 Maroon Tapi OK JE Suka Suka Terima kasih Penjual,5
bj cantik penghantaran cepat semalam bayar hari sudah dapat tq penjual,5
Kualiti Cantik Baju Sesuai Dengan Ank Saya Penghantaran Pun Cepat,5
Fit Kualiti Baju Mantap Saiz Cun Cuma Pos Laju Je Tongk Berapa Nak Laju Seminggu Baru Sampai Kalau J T Selalu 2 Ke 3 Hari Sudah Sampai,5
Penjual Baik Sangat Sangat Melayan Saya Yang Salah Beli Saiz Baju Anak Siap Pos Semula Terima KASIHHH Loudlycryingface KALAU TINK MELAYAL LAGI DUIT NAK BAJU BAJU BAJU BAJU PENGHANTARN PUN CEPAT TQTQTQ,5
Baju Cantik Labuh Tangan Je Panjang Sikit Tongk apa Boleh Lipat Atau Jahit Penghantaran Je Slow Poslaju,5
Baju Dah Sampai Kain Cantik Baju Fit2 Dengan Tuan Nya Cuma Penghantaran Laa Makan Masa,4
Senang Seluar Jenis Getah Ni Butang Baju Ni Pula Jenis Klip Je Memang Cantik Sangat Baju Ni Bahan Dia Breatble La Oklah Kalau Budak2 Tu Jenis Aktif Sampai Petang TQ Penjual TQ,5
Penghantaran mengambil sedikit masa pesanan Lepas diletakkan barang -barang dengan selamat dibungkus dengan bungkus gelembung Kain sepadan dengan sen yang dibelanjakan,5
Saya Perintah 3 Pasang Baju Tapi Yang Sampai Hanya 2 Pasang Sudah La Lama Tunggu Sekali Sampai Takda Sepasang Baju Pasti Nak Pakai Raya Tu Kecewa Sikit Cryingface Cryingface Cryingface Tapi Kain Puas Sangat,3
Saiz Fit Dengan Saya Dan Akain Kain Cantik Dan Jahitan Kemas akan membeli lagi TQ,5
Anak Saya Nak Masuk 6 Tahun Saya Ambik Saiz 7 8 Memang Fit2 Nasib Tarik Ambik Saiz 5 6 Sebab Badan Dia Tinggi Kain Cantik Jahitan Kemas Penyampaian Laju Semalam Sampai Dah Harini Tq Penjual Terbaikk,5
Terbaik Kain Dan Memotong Sama Macam Pengukuran MUAT DENGAN AAK 5 TAHUN,5
Kain Lembut Dan Selesa Butang Jenis Snap Mudah Pakai Warna Tepat Gold Mustard Yang Bestnya Pengukuran Sangat Tepat Anak2 Padan,5
Baju cantik pemotongan ok warna sama macam dalam gambar kain macam keras sikit tapi teripu elok bila pakai harap lepas basuh ok dapat,5
Kain Sangat Selesa Dan Ukuran Terlah Elok Puas Hati Sangat Penghantaran Pn Sangat Laju,5
Baju Dan Seluar Fit Padan Dengan Anak Saya Umur 2 4m Berat 12kg Kain Sangat Berpuas Hati Disyorkan,5
Baju Yang Sangat Cantik Saya Suka Anak Pun Suka Saiz Fit2 Ank Umur 7 Tahun Bahan Ok Semua Ok Boleh Guna Unk Raya Nanti Yeay Tq,5
Jahitan Kemas saiz semua semua ok penghantaran pun cepat terima kasih penjual grinningface herewithsmilingeyes facewithtearsofjoy rollingonthefloorlaughing grinningwithbigeyes grinningwithsmilingeyes grinningwithswitheats,5
Penjual Terbaik Penghantaran Memang Pantas Kain Elok Cantik Jahitan Sangat Kemas Warna Kain Sedondon Anak Dan Ayah,5
Mantap Gila Kain Cantik Warna Kat Gmbar Tenda Lawa Bila Pakai Kacak Alhamdulillah Kacak,5
cantik baJu berkualiti bagus dan cukup dengan anak anak umur 6 tahun,5
Biru Dia Cair Sikit Laaa Tetapi masih bayi biru saiz Muat Dengan Badan Cuma Labuh Seluar Kain Pun Cantik Sejuk Je Pakai Memang Muat Cantik Handsome Anak Buah Hahaha Penjual Laju Shopee,5
Kain Cantik Kemas Je Rasanya Kain Agak Panas Tu Si Bulat Agak Taksesuai Mungkin Patut Pakai Kurta Je,5
BAJU RAYA AAK2 SUDAH SMPAI Bintang melanda Kain Lawa Sarat Saiz Fit Unak Anak2 Adik Umur 6y Berat 20kg Abang 8y Berat 22kg Abang Yang Terujapenjual akan mengulangi tidak lama lagi redheart redheart redheart redheart redheart,5
Barang Dah Terima Baju Nampak OK Penghantaran Yang Cepat Terbaik,5
Baju Melayu Cantik Gila Penyampaian Penghantaran Cepat Pada Titik Sangat Mengesyorkan Kedai Dalam Talian Ini,5
Kain Lembut Design Modern Beli Dua Dapat Diskaun Servis Mantap Terima KASIH,5
Baju Sampai Awal Terbaik Kualiti Kain Memuaskan Harga Berpatutan berulang pelanggan di sini,5
Baju Puas Hatu Trendy Habis Penghantaran Pantas Penuh Rekomen Terima KASIH Penjual,5
kedai dalam talian,5
Ulangi pesanan dah kali ke 3 kualiti tolak pernah enjecewakan perkhidmatan pelanggan memuaskan,5
Suka Sangat Reka Bentuk Baju Kain Sejuk Harga Berpatutan Penghantaran Pantas Terbaik,5
Kualiti Kain Tolak Seberapa Design OK Tapi Agak Kecewa Dengan Kualiti Bahan,2
Pertama Kali Beli Memang Puas Hati Baju Cantik Harga Berpatutan akan mengulangi pesanan,5
Reka bentuk moden harga berbaloi kain selesa sangat penghantaran pantas terbaik lah,5
Baju Sampai Awal Kualiti Memang Petua Saiz Top Kena Harga Berpatutan disyorkan,5
BARANG SAMPAI DENGAN SELAMAT SANGAT PUAS HTI NGN KUALITI KAIN JAHITAN KEMAS SANGAT Disyorkan,5
warna seperti dalam pic ukuran itu fit2 dengan badan anak takut tarik sempat untuk raya haji ja apa pun pun penghantaran cepat bungkusan baik,5
Bahan Kain ok warna pun cantik saiz cun je badan anak sebab chubby,5
kali ke 2 beli selepas pembelian pertama salah size  sleepyface  kali ni size ok cuma seluar senteng sikit anak 7tahun berat 25kg kain selesa warna cantik sebab tu sanggup order lagi siapa nak beli saiz 8 dm saya ok tidak ada yang nak pakai  smilingfacewithsmilingeyes tq seller yang baik hatitq abang pos disyorkan thumbsup thumbsup,5
PUAS HATI KAIN SANGAT CANTIK Memang Beraloi Penjual yang Dipercayai Penghantaran Pun Cepat,5
Baju Ok Tetapi Macam Susah Nak Masuk Kepala Nak Masuk Lengan Anak BaruLembut Sikit Tetapi Gelap Sikit Dari Pink Yang DiCari,5
baju sangat cantik  jahitan kemas  warna cantik   saiz 2 sesuai untuk baby 1 tahun 3bulan  cuma tangan   selur panjang sikit  tapi boleh je alter  untuk size 3 4 tahun  baju nya ada singkat sikit  mungkin anak i tinggi kot facewithhandovermouth   button baju pun sesuai sangat  tapi overall puas hati  nextMasa Beli Lagi,5
Kainnya okay tongk terlalu tebal unak anak kecil memang terbaik untuk pagi raya nanti,5
Penghantaran Cepat Terima Dalam Condition Baik Kain Sangat Elok Terbaik MAAF VIDEO TIN INTA KENA MENGEN,5
Penjual TQ Baju Cepat Sampai Tetapi Kain Easaya Penuh Tarik Nipis Tarik Tebal Sangat,5
Penghantaran Boleh Tahan Lama Juga Sebab Guna J T pada Masa Tu J T Damansara Ada Masalah GrinningWithSwithSwithSwithSwithSwithSwithWithSwithSwithSwithSwithSwithSwithSwithSwithSwithSwithSwithSwithSwithSwithSwithSwithSwithSwithSwithSwithSwithSwithSwithSwithSwithSwithSwithSwithSwithSwithSwithSwithSwithSwithSwithSwithSwithSwithSwithSwithSwithSwithSwithswithswithswithswithswithswithswithswithswithswithswithswithswithswithswithswithswith,5
Penjual Ok Recomended Sangat Barang Cantik Penghantaran Cepat Thumbsup Thumbsup Maaf Video Tolak Ada Kena Mengena Foldedhands Foldedhands,5
material bagus tebal  lambat pengeposan 6 hari baru seller pos out itu pun lambat betul response naik geram dibuatnya nasib baju cantik tetapi  koyak sikit kat baju itu jahit sendirilah sebab majlis pun sudah dekat harap seller response cepat bila kita ask,4
keselesaan bahan bagus semua baik okay anak pun suka yang penting selesa,5
bahan okay keselesaan okay kain okay standard kain baJu melayu warna cantikk baJu besar sikit sebab anak 1tahun 1 bulan ambil saiz 1 2 tahun dekat baJu saiz 2 tapi okay la boleh pakai lama terima kasih penjual,5
Keselesaan Baju Raya Bahan Helok MAAF Pic Tiada Kena Mengena Baju Cantik Sangat Kain Helok Sesuai Unak Aak2 Seluar Macam Besar Sikit TQ Penjual Saya Suka Suka,5
Baju Dah Sampai Puas Hati Size Sama Dengan Anak Kualiti Pun yang Terbaik,5
Bahan Keselesaan Lembut Keselesaan Penghantaran Pantas Saiz Fit Dengan Anak Dan Suami,5
Baju Raya Anak2 Sudah Sampai saiz ok saiz memang kain dia ok sangat 2 niceeee takrugi pun beli tau lelaki siapa siapa yang nak cari baJu raya unak2 tu beli lah di kedaiUlangi Balik Kedai Ni TQ Shopee Express TQ Penjual Saya Amat Berpuas Hati TQ,5
Baju Dah Sampai Cantik SANGAT SUKA SAIZ 8 FIT DENGAN UMUR ANAK 7TAHUN TQ Penjual Warna Cantik Tema Tahun Ni Berbaloi Harga Murah Berbaring Kedai Lain Boleh REPEAT LAGI LEPAS NI NI,5
keselesaan yang baik thumbsuplightskintone bahan yang baik thumbsuplightskintone tahun -tahun terakhir pernah beli dan sekarang kali ke -2 beli yang baik dengan tangan yang baik,5
Saiz Keselesaan Bahan tepat Bahan Baju Cantik dan Penghantaran Cepat Anak Suka,5
Keselesaan Selesa Dusty Hijau ini Bright Sikit Dah Nak Ke Warna Grey Labuh Dan Panjang Sikit Tetapi Ok Jeruk Penghantaran Pun Cepat Selamat Hari Raya Maaf Zahir Batin Terima kasih Penjual,5
Jahitan Kemas Kain Tebal Harap Anak Takpanas Bila Pakai Nanti Saiz Sesuai Unit Anak Umur 3TAHUN 10 BUGAN KALAU NAK NOSIGHT SIKIT KENA AMBIL SIZE BESAR BESAR,5
bahan macam panas keselesaan okay good anak umur 1tahun 6bulan pakai memang fit badan saiz sedap2 gitu apa pun baJu memang mantap penghantaran pantas insayaallah seterusnya boleh berulang harga munasabah baja pintar munasabah,5
bahan Kain terbiik penyejukan keselesaan SANGAT SELHAMDULILAH DAH DAPAT BAJU RAYA AAK AAK WALAPUN SAYA BAJU BAJU NUDE CREAM er punBaik Sporting Sangat Disyorkan Untuk Siapa Siapa Nak Cari Baju Raya,5
Bahan Sejuk Tetapi Muda Carik Keselesaan Ok Warna Cantik Saiz Fit Tetapi Jenis Kain Cepat Carik Anak Baru Pakai Sekejap Seluar Dah Mula Nampak Kesan Caik di Jahitan Dari Dalam Sadbutrelievedface,4
Penghantaran Kain Selesa Terbaik Cepat Dan Pantas Baju Sesuai Seperti Saiz Bagus Saya Suka Suka Suka,5
Parcel Sampai Dengan Elok Big Sikit Baju Dengan Anak Tapi Tarik Apa Lah Boleh Pakai Lagi Nanti,5
keselesaan keselesaan dan bahan panas bahan yang baik bukan panas ke pakai thumbsuplightskintone bernilai harganya,5
Keselesaan Selesa Bahan Kain Elok Tarik Nipis Tarik Panas Saiz Sesuai Dengan Anak2 Umur 3 Tahun Dan 5 Tahun Alhamdulillah TQSM Penjual Kapal dan Penghantaran Laju Saya Beli Ya Ya,5
Keselesaan Bahan Keselesaan Nice Setiap Tahun Ulang Sini Kain Baikk Dan selesa Jahitan Kemas,5
keselesaan bahan cantik seakan kain mahal perintah semalam sampai hari ini,5
Keselesaan Selesa Bahan Tebal Seny Iron Maaf Video Takda Kaitan Anak 10 Tahun Skinny Tinggi Besar Dan Labuh Dengan Dia Tetapi Ok Je Boleh Pakai Lama Suka Beli Sebab Kain Kain Diaang Iron Tongk sanagt Dan Terang Terlalu Nipis Nipis Nipis Nipis Nipis Nipis Nipis Nipis Nipis Nipispenjual yang dipercayai Sangat,5
Keselesaan Selesa Untuk Kanak -kanak Bahan Kapas Lembut Serap Peluh Memang Sesuai Untuk Kanak -kanak Beraya Tarik Panas Serius Cun Sangat N Selesa Saya Risau Beli Dalam Talian,5
Bahan Cantik Sangat Jahitan Anda Semua Kena Beli Dekat Penjual Ni Cepat Je Dia Buat Keja Order Cepat Sampai Fabric Baju Size Dengan Anak Saya 10tahun Baju Lawa Color Menarik Whiteheart,5
Keselesaan Bahan Baik Cantik Sangat Cantik Saiz Pun Fit Cuma Unk Ank Setahun Je Labuh Sikit Tetapi Tarik Apa Boleh Lipat Kain Pun OK Penjual Sangat Peramah Dan Sangat Membantu,5
Bahan Kain Tebal Trust Penjual Checkmarkbutton Ratusan Titik Asal Produk Pembungkusan KEMAS Dan Baik thumbsuplightskintone Thumbsuplightskintone Thumbsuplightskintone Response Cepat Penghantaran Cepat,5
Bahan Terbaik Penghantaran Warna Cepat Pun Cantik Sesuai Unak Anak Umur 2 Tahun Setengah Dan 6 Tahun Set Anga,5
Bahan Giod Comfortability Baik Barang Sudah Sampai Penghantaran Yang Pantas TQ Penjual Thumbs Up Senyum Wajah,5
Keselesaan Selesa Bahan Kain Ok Baju Sudah Sampai Kain Cantik Jahitan KEMAS TQ Penjual,5
Bahan Berkualiti Comfortability Selesa Jahitan Sangat Kemas yang berpuas hati Dengan Baju Melayu Ni Terbaikkk,5
bahan kualiti baik baJU ok selesa cuma kalau ikut sizing baJu melayu baJu ni agak pendek sedikit kelabuhanya keseluruhan ok tqsm,4
alhamdulillah baju sampai dengan selamat   first time beli online sebab malas nak bersesak sesak   warna pun sama dengan baju mommy nya   kain pun cantik nice je   cuma senteng sikit dekat anak 5yo dan 7yo tu   mungkin sekali je dua je boleh pakai   tapi tidak apa murah je   tidak rugi sangatLah Beli,5
Bahan keselesaan terbaik selesa sesuai dengan dengan anak akil kurus je 5 tahun tetapi ambil yang saiz 3 4 tahun,5
keselesaan bahan yang sangat baik yang sangat baik membeli ini untuk adik saya dan dia sangat menyukainya saiz juga baik dan Kain adalah warna yang baik di sini kerana pencahayaan tetapi warna dalam kehidupan sebenar dengan pencahayaan yang baik dekat dengan gambar promoakan beli lagi dengan penjual ini pada masa depan ahaha terima kasih Tuhan tiba sebelum minggu depan raya loudlycryingface rollingonthefloorlaughing rollingonthefloorlaughing,5
Terima KASIH Penjual Barang Sampai Dengan Safe Walaupun Lewat Sangat Tapi Puas Hatilah Kain Baju Bagus Dan Cantik Sesuai Lah Unak Anak Pakii Raya Ni Nanti Nanti MaafBar Dan Video,5
Bahan Warna Cantik Kain Selesa Saiz Potongan Sesuai Utuk Kana Kanak 1 Tahun 3 Bulan MAAF GAMBAR TIADA KAITAN,5
Keselesaan Jahitan KEMAS Harga Murahh Bahan Nice Sesuai Dengan Harga Keseluruhan Puja Penjual TQ Redheart Anak Setahun 6 BULAN,5
Bahan Moss Crepe Comfortability Terpae Selesa Anakku Umur 3 Tahun Berat 15kg Baju Selesa Suami I Yang Cerewet Bab Bahan Baju Pun PuJi Bahan Baju Ini,5
keselesaan ok bahan baik baJu ok dan baik saiz sesuai dengan anaklu baju ada congek sedikit dekat belakat,5
Kain Ada noda sedikit,3
Kualiti Kain Dan Ukuran Ok tidak pasti sebab apa lulu lisu sebesar lidi di setiap poket kalau tahu awal nak return ja tetapi tetapi perasan lepas basuh tongk tahu la penjual perasan atau tiden pensive,2
Beli Sampai Harga Nak Dekat Rm50 Tapi Baju Hampeh Kotor Sudah Basuh Pakai Berus Cane Pun Takleh Hilang Mungkin Pelanggan Lain DapatLengkapkan Haih Raya La Adikku Dengan Baju Kotor,2
Seluar Umur 7 8 TAHUN Bukan Saiz Standard Anak Saya Tinggi Untuk 8 Tahun Kira Rendah Sikit Baya 7 Tahun Seluar Senteng Kecewa Unit Seluar Anak Usia 2 Tahun Boleh Hntr Seluar Tolak Patut Qc Sblm Klua Klua Klua Klua Klua Kluahntr kedai n byr kos tmbhn untuk alter,2
Baju Senget Ukuran Tongk sama Poslaju Lambat Hantar Barang Dekat 10hari Bru Smpai Baju Plk Ade Kesan Kotor So Bad Rugi Duit Aku Ini Pertama Beli Dalam Shoppe Service Teruk Macam Ini,1
Penjual Tolak ResponApa hanya Bagitau Tolak Boleh,1
Pelik Kenapa Dekat Poket Baju Melayu Ada Hole Sakit Mata Mata Tengok Beli Baju Baru Bukan Bundle Bundle,1
memerintahkan 2 pasang baji untuk raya tetapi hantar satu pasang baJu cakap nak hantar semula yang tertinggal tetapi sampai sekarang tongk Ada respond,1
Saiz Bagus Tapi yang berkualiti m Barat Betul Kena Ambil 1 Saiz kecil Dari normal,3
MULA2 OK dan CONTIK BAJUNYA Tapi dia punya Kain Jenis Cepat Pecah Sebab Bila Pakai Je Koyake Dekat Tepi Jadi saya menasihati pembeli Kepada Yang Lain untuk membeli lebih besar untuk mengelakkan kejadian ini,3
Baju Sudah Sampai Lama Sebelum Raya Baru Mahu Kadar Tetapi ITU La Jauh Sangat Warna Mustard Emas Tu SmilfaceWithtear Facewithtearsofjoy Mahu Cuba kembali,3
paparan yang sangat kecewa 3 Butang Mari Hantar 5 Butang Sudah Satu Hal Nak Return Nak Cari Masa Pergi Post Office Harap Shopee Dilarang Je Peniaga Begini Paparan Lain Hantar Lain Hati Hati Guys Paparan Tolak Sama Dengan Barang Barang,1
bahan kualiti bagus baju ok selesa cuma kalau ikut sizing baJu melayu baJu ni agak short sedikit kelabuhanya keseluruhan ok tqsm,4
Baju Dah Sampai Kain Cantik Baju Fit Dengan Tuan Nya Cuma Penghantaran Laa Makan Masa,4
Lambat Pengeposan 6 Penjual Hari Baru Pos Out Tu Pun Lambat Betul Response Naik Geram Dibuatnya Nasib Baju Cantik Tetapi Koyak Sikit Kat Baju Tu Jahit Sendirah Sebab Majlis Pun Dah Dekat Harap Penjual lebih cepat,4
Saya tunggu maklum balas hampir seminggu tetapi penjual ni tetap tolak responden pm Saya jadi saya terpaksa rating buruk Saya amat kecewa dengan kualiti baJu yang dibeli puji inijadi macam ni kualiti amat terima kASIH kerana mengana menta sebagai pelanggan semoga hasil pernigaan anda berkat,1
Penjual sangat menonjol sebab selalu balasan dalam satu jam saya SANGAT SATISIFED DENGAN BAJU INI Saya akan mengulangi perintah Lain Kali,5
Perkhidmatan Penghantaran Sangat Cepat Saya Perintah Isnin Khamis Dah Dapat Baju Ni Cantik Dan Selesa Dipakai Suami I Sngt Puas Hati Terima KASIH Penjual SBB Jawab Segera Dan Akan Repeat Order Lagi Tahun depan,5
Baju Dah Sampai Dan Baju Ini Sesuai dengan Anak Saya Sangat Baik Saya Akan Ulang Perintah Untuk Suami Cuma Penjual Lambat Balas Mesej Saya Hantar Tapi Dua Hari Lepas Baru Dapat,4
Nak Minta Tukar Saiz SBB Ank Pakai Besar Memotong Sedikit Besar Mintak Exchange Tapi Kena Menolak Masa Pertama Saya Rate Macam INI Saya Bkn Cerewet Cuma,1
Baju Sampai Lambat Sangat Kualiti Teruk Harga Mahal Service Buruk Tongk mengesyorkan Langsung,1
Reka Bentuk Baju Hambar Harga Tongkai Menghantaran Lambat Gila Sangat Kecewa Elakkan Kedai,2
Teruk Betul Baju Ni Size Tolak Kena Kain Murah Servis Teruk Penipu Tongk seorang Beli Lagi,1
Penghantaran Lambat Baju Rosak Kualiti Teruk Tolak Sesuai Dengan Harga Buruk,1
BAJU TINK SAMPAI SAMPAI SIZE Tolak Kena Harga Mahal Perkhidmatan Pelanggan Tongk Boleh Harap,2
Teruk Betul Service Baju Tongk selesa Harga Tongk Beraloi Penipu Barat Sangat Kecewa,1
Reka bentuk Baju Tongk cantik Langsung Kualiti Teruk Harga Mahal Penghantaran Lambat Sangat,2
Baju Tongka Serupa Dalam Gambar Kualiti Teruk Harga Sangat Lebih Perkhidmatan Sangat Buruk,1
Saiz Baju Tongk Kena Kain Murah Service Teruk Tidak Bernilai,2
PESANAN TINK SAMPAI BAJU TINDA PENGURUSAN PERKHIDMATAN MAHAL BURUK GILA JANGAN BELI DI SINI,1
Baju Melayu kelihatan bergaya tetapi kualiti kain mengecewakan Penghantaran tepat pada waktunya tetapi tidak bernilai harga,3
Reka bentuknya bagus tetapi saiznya adalah Kain Agak Nipis tidak bernilai wang yang dibelanjakan,3
Baju Cantik Tetapi Harga terlalu tinggi Kualiti Kain hanya rata -rata tidak istimewa,3
Servis Penghantaran baik tetapi Baju tiba dengan kecacatan Kain Kasar tidak berpuas hati dengan pembelian,3
Reka bentuknya bergaya tetapi ukurannya tidak konsisten Kualiti Kain boleh diterima untuk harga yang dibayar,3
Baju Melayu kelihatan baik tetapi Kain terlalu nipis baik tetapi bukan nilai terbaik,3
Baju Sampai dalam keadaan baik tetapi reka bentuknya terlalu sederhana Kualiti Kain hanya rata -rata,3
ok la baJu ni reka bentuknya adalah standard kualiti kain,3
kualiti kain ok je reka bentuknya mudah dan tidak terlalu mencolok.,3
Reka Bentuk Menarik Kain Sejuk Harga Bernilai Untuk Kualiti Servis Penghantaran Cekap,3
Sudah tentu inilah ulasan tanpa penomboran,4
Baju Melayu Cun Habis Berkualiti Hebat Harga Berpatutan Penghantaran Cepat Puas Hatu Dengan Servis Penjual,5
Kedai Dalam Talian Terbaik Baju Cantik Reka Bentuk Moden Penghantaran Pantas Sizing Kena Sangat Disyorkan Untuk Semua,4
Kain Sejuk Reka Bentuk Trend Baju Sampai Awal Harga Berbaloi Repeat Order Dah Beberapa Kali Puas Hati,4
Penghantaran Cepat Baju Berkualiti Tinggi Sizing Betul Harga Berpatutan Terima KASIH Penjual Puas Hati Dengan Pembelian,4
Baju Stylish Gila Kain Berkualiti Harga Berbaloi Repeat Pelanggan Sebab Servis Memuaskan Dan Reka Bentuk Sentiasa terkini,4
Baju Sampai Awal Kemas Habis Kain Selesa Harga Berpatutan Servis Penghantaran Memuaskan Terima KASIH Penjual,5
Baju Cantik Sangat Kain Lembut Ukuran pada Point Fast Delivery Harga Berbaloi Terima KASIH Suka Suka Sangat,5
Reka Bentuk Baju Menawan Penghantaran Pantas Harga Berpatutan Kualiti Kain Memuaskan Hatu Terima KASIH Banyak Penjual,5
Baju Sampai Awal Packaging Cantik Reka Bentuk Kreatif Harga Berpatutan Perintah Ulang Terus Servis Bagus Terbaik,4
Baju Melayu Moden Kain Berkualiti Tinggi Harga Berbaloi Penghantaran Cepat Sizing Kena Puas Hati Dengan Pembelian Saya,4
Baju Melayu Ini Okay SAJA Reka Bentuk Standard Harga Tongk terlalu Mahal Penghantaran Agak Cepat Kualiti Kain Biasa Biasa Saja Tarik Terlalu Puas Hati Tapi Bolehlah,3
Baju Sampai Dalam Masa yang Reka Bentuk Berpatutan Klasik Kain Okay Harga Agak Mahal Sedikit Tapi Kualiti Boleh Terima Penghantaran Memuaskan Boleh Perbimbangkan,3
Baju Melayu Ini,3
Baju Sampai Awal Design Standard Kain Agak Selesa Harga Berpatutan Penghantaran Memuaskan Puas Hati Sedikit Tapi Keseluruhan Baiklah Bolehlah Pertian Untuk Beli Lagi,3
Baju Melayu INI AGAK Reka Bentuk Standard Biasa Kain Tarik Terlalu Selesa Harga Berpatutan Penghantaran Memuaskan Puas Hati Sederhana Mungkin Akan,3
Baju Sampai Tepat MaSanya Reka Bentuk Tongk terlalu Menarik Kain Okay Harga Agak Mahal Penghantaran Cepat Puas Hati Sedikit Mungkin Boleh Mencuba Yang Lain Lain Lain Lain Lain Lain Lain Lain,3
Baju Melayu Ini Biasa Biasa SAJA Design Klasik Kain Standard Harga Boleh Terima Penghantaran Memuaska Puas Hati Sedikit Mungkin Akan,3
Baju Sampai Dalam Keadaan Baik reka bentuk Simple Kain Sejuk Harga Berpatutan Penghantaran Cepat Puas Hati Sederhana Mungkin Akan,3
Baju melayu ini okay lah reka bentuk standard kain boleh terima harga agak mahal penghantaran memuaskan puas hatu sedikit tapi keseluruhan okay bolehlah pertinbangkan unuk beli lagi,3
